identifier,brand,platform,category,title,url,image,rating,reviews
B08WTXG9TC,Frida,Amazon,,"FridaBaby Replacement Filter for 3-in-1 Air Purifier with Activated Carbon Filter to Remove Odors, Air Pollution & More",https://www.amazon.com/dp/B08WTXG9TC,https://m.media-amazon.com/images/I/81Te-vYavoS._AC_UL320_.jpg,4.8,323
B01644OCPE,Frida,Amazon,,Fridababy FeverFrida Adhesive Patches,https://www.amazon.com/dp/B01644OCPE,https://m.media-amazon.com/images/I/51glGMmN8uL._AC_UL320_.jpg,4.2,282
B09QRLZQP4,Frida,Amazon,,Frida Mom C-Section Silicone Scar Patches | Reusable Medical Grade Silicone Scar Treatment | Great for Keloid Scars | 6 8" Long Patches with Case and Pouch Included,https://www.amazon.com/dp/B09QRLZQP4,https://m.media-amazon.com/images/I/61jnUmvqN1L._AC_SX352_SY330_.jpg,4.5,259
B099FH1425,Frida,Amazon,,Head Shoulders Knees & Toes Shampoo + Body Wash by Frida Baby Head to Toe Tear Free Baby Shampoo and Body Wash for Sensitive Skin and Dry Skin,https://www.amazon.com/dp/B099FH1425,https://m.media-amazon.com/images/I/61UKjuKqDNL._AC_UL320_.jpg,4.6,258
B09QH5GYPB,Frida,Amazon,,"Frida Mom Pregnancy Discreet Belly Band Tape | Kinesiology Tape for Pregnant Skin | Maternity Belly Support, Pain + Strain Relief | 18 Foot roll with Storage Dispenser",https://www.amazon.com/dp/B09QH5GYPB,https://m.media-amazon.com/images/I/714PtoFlZqL._AC_SX352_SY330_.jpg,3.3,257
B09QH6WQZ4,Frida,Amazon,,"Frida Mom Pregnancy Belly Band Tape | Discreet Kinesiology Tape for Pregnant Skin | Maternity Belly Support, Pain + Strain Relief | 18 Foot roll with Storage Dispenser",https://www.amazon.com/dp/B09QH6WQZ4,https://m.media-amazon.com/images/I/71PbJBxVpRL._AC_SX352_SY330_.jpg,3.3,257
B07CVKRG7F,Frida,Amazon,,"DermaFrida The SkinSoother Baby Bath Silicone Brush by Fridababy | Baby Essential for Dry Skin, Cradle Cap and Eczema (1 Pack)",https://www.amazon.com/dp/B07CVKRG7F,https://m.media-amazon.com/images/I/81KakNaiuxL._AC_UL320_.jpg,4.7,248
B09LDTSY56,Frida,Amazon,,4-in-1 Grow-with-Me Bath Tub & Control The Flow Rinser Cup Bath Time Kit,https://www.amazon.com/dp/B09LDTSY56,https://m.media-amazon.com/images/I/71UE7iG1oyL._AC_UL320_.jpg,4.8,193
B091V1P2C5,Frida,Amazon,,Frida Mom Postpartum Supplement Set | Postpartum Gummies for Pooping (30 Count),https://www.amazon.com/dp/B091V1P2C5,https://m.media-amazon.com/images/I/71G5Po2slQL._AC_SX352_SY330_.jpg,4.4,112
B09SMRJFXP,Frida,Amazon,,"Frida Mom C-Section Recovery Kit for Labor, Delivery, & Postpartum| Socks, Peri Bottle, Disposable Underwear, Abdominal Support Binder, Shower Wipes, Silicone Scar Patches, Toiletry Bag",https://www.amazon.com/dp/B09SMRJFXP,https://m.media-amazon.com/images/I/61ds2wnEggL._AC_SX352_SY330_.jpg,4.5,102
B0B3H42JVX,Frida,Amazon,,Postpartum C-Section Recovery Kit + Recovery Band,https://www.amazon.com/dp/B0B3H42JVX,https://m.media-amazon.com/images/I/612-l+IjzIL._AC_SX352_SY330_.jpg,4.5,102
B0B1JQHYCQ,Frida,Amazon,,"Frida Mom Anti-Nausea Band, 24/7 Morning Sickness Relief Through Pressure Point Therapy, Includes 2 Bands + Storage Case",https://www.amazon.com/dp/B0B1JQHYCQ,https://m.media-amazon.com/images/I/61RY3--Hp6L._AC_SX352_SY330_.jpg,3.8,84
B09M3445R3,Frida,Amazon,,Baby Nasal Aspirator NoseFrida and Electric NoseFrida Bundle by Frida Baby,https://www.amazon.com/dp/B09M3445R3,https://m.media-amazon.com/images/I/71Bysnx+TbL._AC_SX352_SY330_.jpg,4.3,51
B084H8YTJ4,Frida,Amazon,,Breathefrida Vapor Wipes for Nose or Chest (3 Pack) by Frida Baby,https://www.amazon.com/dp/B084H8YTJ4,https://m.media-amazon.com/images/I/71rZ9SgK8BL._AC_UL320_.jpg,4.6,50
B0B992G32B,Frida,Amazon,,Frida Mom Bump + Body In-Shower Lotion - Moisturizing + Hydrating for Pregnant Dry & Stretched Skin - 6 oz,https://www.amazon.com/dp/B0B992G32B,https://m.media-amazon.com/images/I/61unW0UCvKL._AC_SX352_SY330_.jpg,4.5,48
B0B992HN7J,Frida,Amazon,,Frida Mom Leg + Foot Spray for Swelling and Achy Muscle Relief During Pregnancy - 3.4 oz,https://www.amazon.com/dp/B0B992HN7J,https://m.media-amazon.com/images/I/618Vbsx8rHL._AC_SX352_SY330_.jpg,4.5,48
B0B9949JVQ,Frida,Amazon,,"Frida Mom Pregnancy Skincare Body Relief Set for Stretch Marks, Dry Skin, Swelling & Chafing",https://www.amazon.com/dp/B0B9949JVQ,https://m.media-amazon.com/images/I/71p+ZgelqBL._AC_SX352_SY330_.jpg,4.5,48
B0B994CDSB,Frida,Amazon,,Frida Mom Stretch Prep Balm - Moisturizer for Pregnancy Stretch Marks & Perineal Massages - 2.5 oz,https://www.amazon.com/dp/B0B994CDSB,https://m.media-amazon.com/images/I/61aeXugPfnL._AC_SX352_SY330_.jpg,4.5,48
B0B995YGSJ,Frida,Amazon,,Frida Mom Pregnancy No-Friction Anti-Chafe Glide Stick - 1.7 oz,https://www.amazon.com/dp/B0B995YGSJ,https://m.media-amazon.com/images/I/61LwL-P-eaL._AC_SX352_SY330_.jpg,4.5,48
B0BCH5X225,Frida,Amazon,,Frida Baby 3-in-1 Grow-with-Me Potty Transforms from Potty to Toilet Topper and Step Stool | Easy-to-Clean Potty Training System,https://www.amazon.com/dp/B0BCH5X225,https://m.media-amazon.com/images/I/61+SB6-0m5L._AC_SX352_SY330_.jpg,4.9,28
B0BHTNZHM1,Frida,Amazon,,"Frida Baby All-in-One Potty Kit Includes Grow-with-Me Potty, Toilet Topper, Toilet Step Stool, Sink Step Stool, Cleanup Essentials, and Professional Potty Guide",https://www.amazon.com/dp/B0BHTNZHM1,https://m.media-amazon.com/images/I/61Sz-GC6BjL._AC_SX352_SY330_.jpg,4.9,28
B0B9CHX4TY,Frida,Amazon,,Frida Mom Alcohol Detection Test Strips for Breast Milk - at Home or On The go Peace of Mind in 2 Minutes - 15 ct,https://www.amazon.com/dp/B0B9CHX4TY,https://m.media-amazon.com/images/I/61ZFEceGVlL._AC_SX352_SY330_.jpg,4.5,13
B09ZLRSG58,Frida,Amazon,,Booger-Busting and MediFrida Bundle by Frida Baby,https://www.amazon.com/dp/B09ZLRSG58,https://m.media-amazon.com/images/I/71hCFVnEsoL._AC_SX352_SY330_.jpg,4.8,12
B09PZSVKJY,Frida,Amazon,,Control The Flow Rinser + DermaFrida The SkinSoother Silicone Brush by Frida Baby Bath Time Essentials,https://www.amazon.com/dp/B09PZSVKJY,https://m.media-amazon.com/images/I/7148DTYg7oL._AC_UL320_.jpg,4.4,7
B09BRD3754,Frida,Amazon,,"Frida Mom Nursing Pillow Replacement Cover | Gray | Easy-to-Clean, Machine Washable + Super Soft Fabric | Mutil-Purpose Pockets for Storage",https://www.amazon.com/dp/B09BRD3754,https://m.media-amazon.com/images/I/71M7+D6WomL._AC_SX352_SY330_.jpg,1,1
B09RLF527J,Frida,Amazon,,"FridaBaby The NoseFrida Filter Bundle, Windi GasPasser & 3in1 Picker | Baby Healthcare Essentials",https://www.amazon.com/dp/B09RLF527J,https://m.media-amazon.com/images/I/718mZsGj5pL._AC_UL320_.jpg,,
B09ZJMPQ2F,Frida,Amazon,,Postpartum C-Section Recovery Kit + Abdominal Support Binder,https://www.amazon.com/dp/B09ZJMPQ2F,https://m.media-amazon.com/images/I/41Qc8bmpleL._AC_SX352_SY330_.jpg,,
B0B985N2SC,Frida,Amazon,,Baby Nasal Aspirator 60 Hygiene Filters for NoseFrida The Snotsucker by Frida Baby,https://www.amazon.com/dp/B0B985N2SC,https://m.media-amazon.com/images/I/81WwF9zhYJL._AC_UL320_.jpg,,
